{
  "$schema": "https://json-schema.org/draft/2020-12/schema",
  "title": "Current interface inventory; agent-maintained from actual UI, not copied from previous ZIP",
  "type": "object",
  "additionalProperties": false,
  "required": ["schema_version", "project_id", "views", "surfaces", "flows", "excluded"],
  "properties": {
    "schema_version": {
      "const": "1.0"
    },
    "project_id": {
      "type": "string",
      "minLength": 1
    },
    "views": {
      "type": "array",
      "minItems": 1,
      "items": {
        "type": "object",
        "additionalProperties": false,
        "required": ["id", "title", "source_refs", "states"],
        "properties": {
          "id": {
            "type": "string",
            "minLength": 1
          },
          "title": {
            "type": "string",
            "minLength": 1
          },
          "source_refs": {
            "type": "array",
            "minItems": 1,
            "uniqueItems": true,
            "items": {
              "type": "string",
              "minLength": 1,
              "pattern": "^(?!/)(?!.*(?:^|/)\\.\\.(?:/|$))[^\\\\:?#%\\x00-\\x1f]+$"
            }
          },
          "states": {
            "type": "array",
            "minItems": 1,
            "items": {
              "type": "object",
              "additionalProperties": false,
              "required": ["id", "entry"],
              "properties": {
                "id": {
                  "type": "string",
                  "minLength": 1
                },
                "entry": {
                  "type": ["string", "null"],
                  "minLength": 1
                }
              }
            }
          }
        }
      }
    },
    "surfaces": {
      "type": "array",
      "items": {
        "type": "object",
        "additionalProperties": false,
        "required": ["id", "kind", "source_refs"],
        "properties": {
          "id": {
            "type": "string",
            "minLength": 1
          },
          "kind": {
            "type": "string",
            "minLength": 1
          },
          "source_refs": {
            "type": "array",
            "minItems": 1,
            "uniqueItems": true,
            "items": {
              "type": "string",
              "minLength": 1,
              "pattern": "^(?!/)(?!.*(?:^|/)\\.\\.(?:/|$))[^\\\\:?#%\\x00-\\x1f]+$"
            }
          }
        }
      }
    },
    "flows": {
      "type": "array",
      "items": {
        "type": "object",
        "additionalProperties": false,
        "required": ["id", "description", "view_ids", "source_refs"],
        "properties": {
          "id": {
            "type": "string",
            "minLength": 1
          },
          "description": {
            "type": "string",
            "minLength": 1
          },
          "view_ids": {
            "type": "array",
            "minItems": 1,
            "uniqueItems": true,
            "items": {
              "type": "string",
              "minLength": 1
            }
          },
          "source_refs": {
            "type": "array",
            "minItems": 1,
            "uniqueItems": true,
            "items": {
              "type": "string",
              "minLength": 1,
              "pattern": "^(?!/)(?!.*(?:^|/)\\.\\.(?:/|$))[^\\\\:?#%\\x00-\\x1f]+$"
            }
          }
        }
      }
    },
    "excluded": {
      "type": "array",
      "items": {
        "type": "object",
        "additionalProperties": false,
        "required": ["id", "reason"],
        "properties": {
          "id": {
            "type": "string",
            "minLength": 1
          },
          "reason": {
            "type": "string",
            "minLength": 1
          }
        }
      }
    }
  }
}
